{
  "schema_version": "sciencevision.run_metadata.v1",
  "record_kind": "example",
  "run_id": "synthetic-format-example",
  "created_at": "2026-10-06T00:00:00Z",
  "description": "Synthetic format example. Invented task IDs and model results; no model run was performed. Resource revisions are illustrative real references.",
  "dataset": {
    "repository": "SueMintony/ScienceVision-v13-250",
    "revision_name": "f100c5b5a81b395673618054e6ee7894ec3b2417",
    "commit": "f100c5b5a81b395673618054e6ee7894ec3b2417",
    "index_sha256": "f02ae32169ec2bb081cdfe149f88a6abb15ec3bedd875a99eb23cb46ec8ed69d"
  },
  "harness": {
    "repository": "UniPat-AI/BabyVision-v2",
    "commit": "b47f13ac5abb54b9e287ff3131ae7e29771ec53e"
  },
  "model": {
    "name": "example-model",
    "version": "synthetic"
  },
  "sampling": {
    "temperature": 0,
    "top_p": 1,
    "seed": 0
  },
  "environment": {
    "platform": "linux/amd64",
    "python": "3.12",
    "dependencies": {
      "harbor": "synthetic-example"
    }
  },
  "images": [
    {
      "role": "agent",
      "reference": "ghcr.io/unipat-ai/sciencevision-codex@sha256:43b4bf787e205762368aee65588b7a24bac748f267488769152209632efba04c"
    },
    {
      "role": "scorer",
      "reference": "ghcr.io/unipat-ai/sciencevision-scorer@sha256:751eedbd84f4997b897366008e0133c0b7402f65c47e5f531ad2db0a499459d8"
    }
  ],
  "command": [
    "python",
    "-m",
    "scripts.harbor.collect_qagen_results",
    "--run",
    "cc:example-model:work/job-cc",
    "--tasks-root",
    "work/qa"
  ],
  "scope": {
    "task_set": {
      "path": "task_ids.json",
      "sha256": "ae56fb5367e844cce3c7ed00b0ba5618d0f2515dcd19e7fec4cbe6931253bebf"
    },
    "routes": [
      "cc"
    ],
    "repeats": 1
  },
  "coverage": {
    "expected": 4,
    "attempted": 3,
    "completed": 2,
    "eligible_completed": 2,
    "ineligible_completed": 0,
    "citable": 1,
    "blocked": 1,
    "ungated": 0,
    "missing": 1,
    "error": 1,
    "incomplete": 0
  },
  "aggregation": {
    "producer": "collect_qagen_results",
    "mode": "eligible_citable_mean",
    "primary_metric": "answer_score",
    "missing_trial_policy": "reported_separately_not_imputed"
  },
  "artifacts": {
    "leaderboard": {
      "path": "runs_leaderboard.json",
      "sha256": "15fd032910269f515b302cd5ea2379c190da082d747b922f44899578089d6abc"
    },
    "evidence": []
  }
}
